{
  "schema": "specmetry.target-scope/v1",
  "target": {
    "id": "01J9Z3K5Q8R2T4V6W8X0Y2Z4B0",
    "name": "default",
    "ref": "refs/heads/main",
    "snapshot": null,
    "created_seq": 2
  },
  "scope": null,
  "confirm_inputs": {
    "target_id": "01J9Z3K5Q8R2T4V6W8X0Y2Z4B0",
    "seen_scope_confirmation_id": null,
    "baseline_version": 1,
    "source_set_hash": "3b5d9f0c1e2a4b6c8d0e1f2a3b4c5d6e7f8091a2b3c4d5e6f708192a3b4c5d6e",
    "pending_items": 0,
    "must_requirements": ["REQ-001"],
    "effective_waivers": []
  }
}
